root@comp3134-Winter2026:~# tcpdump -n -i eth0
tcpdump: verbose output suppressed, use -v[v]... for full protocol decode
listening on eth0, link-type EN10MB (Ethernet), snapshot length 262144 bytes
21:45:45.819196 IP 138.197.157.175.22 > 72.39.77.253.49649: Flags [P.], seq 3836628550:3836628658, ack 3358667898, win 4589, length 108
21:45:45.819275 IP 138.197.157.175.22 > 72.39.77.253.49649: Flags [P.], seq 108:168, ack 1, win 4589, length 60
21:45:45.819322 IP 138.197.157.175.22 > 72.39.77.253.49649: Flags [P.], seq 168:268, ack 1, win 4589, length 100
21:45:45.819514 IP 72.39.77.253.49649 > 138.197.157.175.22: Flags [.], ack 0, win 2045, length 0
21:45:45.829518 IP 72.39.77.253.49649 > 138.197.157.175.22: Flags [.], ack 268, win 2044, length 0
21:45:45.831312 IP 72.39.77.253.49649 > 138.197.157.175.22: Flags [P.], seq 1:37, ack 268, win 2044, length 36
21:45:45.831480 IP 138.197.157.175.22 > 72.39.77.253.49649: Flags [P.], seq 268:304, ack 37, win 4589, length 36
21:45:45.855301 IP 72.39.77.253.49649 > 138.197.157.175.22: Flags [P.], seq 37:73, ack 304, win 2044, length 36
21:45:45.855501 IP 138.197.157.175.22 > 72.39.77.253.49649: Flags [P.], seq 304:340, ack 73, win 4589, length 36
21:45:45.883504 IP 72.39.77.253.49649 > 138.197.157.175.22: Flags [P.], seq 73:109, ack 340, win 2043, length 36
21:45:45.883701 IP 138.197.157.175.22 > 72.39.77.253.49649: Flags [P.], seq 340:376, ack 109, win 4589, length 36
21:45:45.913662 IP 72.39.77.253.49649 > 138.197.157.175.22: Flags [P.], seq 109:145, ack 376, win 2043, length 36
21:45:45.913832 IP 138.197.157.175.22 > 72.39.77.253.49649: Flags [P.], seq 376:412, ack 145, win 4589, length 36
21:45:45.918349 IP 138.197.157.175.22 > 72.39.77.253.49649: Flags [P.], seq 412:1920, ack 145, win 4589, length 1508
21:45:45.929431 IP 72.39.77.253.49649 > 138.197.157.175.22: Flags [.], ack 1872, win 2047, length 0
21:45:45.945552 IP 72.39.77.253.49649 > 138.197.157.175.22: Flags [P.], seq 145:181, ack 1920, win 2047, length 36
21:45:45.945735 IP 138.197.157.175.22 > 72.39.77.253.49649: Flags [P.], seq 1920:1956, ack 181, win 4589, length 36
21:45:45.975493 IP 72.39.77.253.49649 > 138.197.157.175.22: Flags [P.], seq 181:217, ack 1956, win 2047, length 36
21:45:45.975692 IP 138.197.157.175.22 > 72.39.77.253.49649: Flags [P.], seq 1956:1992, ack 217, win 4589, length 36
21:45:46.007452 IP 72.39.77.253.49649 > 138.197.157.175.22: Flags [P.], seq 217:253, ack 1992, win 2047, length 36
21:45:46.007667 IP 138.197.157.175.22 > 72.39.77.253.49649: Flags [P.], seq 1992:2028, ack 253, win 4589, length 36
21:45:46.021906 IP 138.197.157.175.22 > 72.39.77.253.49649: Flags [P.], seq 2028:2184, ack 253, win 4589, length 156
21:45:46.022173 IP 138.197.157.175.22 > 72.39.77.253.49649: Flags [P.], seq 2184:3020, ack 253, win 4589, length 836
21:45:46.031485 IP 72.39.77.253.49649 > 138.197.157.175.22: Flags [.], ack 2184, win 2046, length 0
21:45:46.031486 IP 72.39.77.253.49649 > 138.197.157.175.22: Flags [P.], seq 253:289, ack 2184, win 2046, length 36
21:45:46.031704 IP 138.197.157.175.22 > 72.39.77.253.49649: Flags [P.], seq 3020:3056, ack 289, win 4589, length 36
21:45:46.043570 IP 72.39.77.253.49649 > 138.197.157.175.22: Flags [.], ack 3056, win 2043, length 0
21:45:46.053529 IP 72.39.77.253.49649 > 138.197.157.175.22: Flags [P.], seq 289:325, ack 3056, win 2043, length 36
21:45:46.053721 IP 138.197.157.175.22 > 72.39.77.253.49649: Flags [P.], seq 3056:3092, ack 325, win 4589, length 36
21:45:46.070658 IP 152.42.142.133.47516 > 138.197.157.175.22: Flags [S], seq 2748487237, win 64240, options [mss 1460,sackOK,TS val 747052692 ecr 0,nop,wscale 7], length 0
21:45:46.070714 IP 138.197.157.175.22 > 152.42.142.133.47516: Flags [S.], seq 2779410483, ack 2748487238, win 65160, options [mss 1460,sackOK,TS val 2012549849 ecr 747052692,nop,wscale 7], length 0
21:45:46.083443 IP 72.39.77.253.49649 > 138.197.157.175.22: Flags [P.], seq 325:361, ack 3092, win 2043, length 36
21:45:46.083671 IP 138.197.157.175.22 > 72.39.77.253.49649: Flags [P.], seq 3092:3128, ack 361, win 4589, length 36
21:45:46.093639 IP 138.197.157.175.22 > 167.99.47.139.36186: Flags [P.], seq 3337605129:3337605197, ack 1645874359, win 502, options [nop,nop,TS val 1886760759 ecr 855912207], length 68
21:45:46.101633 IP 138.197.157.175.22 > 64.226.92.248.38446: Flags [P.], seq 2999736256:2999736308, ack 414523348, win 532, options [nop,nop,TS val 965392609 ecr 869659926], length 52
21:45:46.111450 IP 72.39.77.253.49649 > 138.197.157.175.22: Flags [P.], seq 361:397, ack 3128, win 2043, length 36
21:45:46.111660 IP 138.197.157.175.22 > 72.39.77.253.49649: Flags [P.], seq 3128:3164, ack 397, win 4589, length 36
21:45:46.126403 IP 138.197.157.175.22 > 72.39.77.253.49649: Flags [P.], seq 3164:5312, ack 397, win 4589, length 2148
21:45:46.137532 IP 72.39.77.253.49649 > 138.197.157.175.22: Flags [.], ack 5312, win 2047, length 0
21:45:46.137532 IP 72.39.77.253.49649 > 138.197.157.175.22: Flags [P.], seq 397:433, ack 5312, win 2047, length 36
21:45:46.137710 IP 138.197.157.175.22 > 72.39.77.253.49649: Flags [P.], seq 5312:5348, ack 433, win 4589, length 36
21:45:46.159673 IP 72.39.77.253.49649 > 138.197.157.175.22: Flags [P.], seq 433:469, ack 5348, win 2047, length 36
21:45:46.159860 IP 138.197.157.175.22 > 72.39.77.253.49649: Flags [P.], seq 5348:5384, ack 469, win 4589, length 36
21:45:46.164023 IP 152.42.142.133.47516 > 138.197.157.175.22: Flags [.], ack 1, win 502, options [nop,nop,TS val 747052786 ecr 2012549849], length 0
21:45:46.174988 IP 138.197.157.175.22 > 152.42.142.133.47516: Flags [P.], seq 1:44, ack 1, win 510, options [nop,nop,TS val 2012549953 ecr 747052786], length 43: SSH: SSH-2.0-OpenSSH_9.6p1 Ubuntu-3ubuntu13.14
21:45:46.191368 IP 72.39.77.253.49649 > 138.197.157.175.22: Flags [P.], seq 469:505, ack 5384, win 2047, length 36
21:45:46.191535 IP 138.197.157.175.22 > 72.39.77.253.49649: Flags [P.], seq 5384:5420, ack 505, win 4589, length 36
21:45:46.197232 IP 64.226.92.248.38446 > 138.197.157.175.22: Flags [.], ack 52, win 501, options [nop,nop,TS val 869739605 ecr 965392609,nop,nop,sack 1 {0:52}], length 0
21:45:46.197286 IP 138.197.157.175 > 64.226.92.248: ICMP 138.197.157.175 tcp port 22 unreachable, length 72
21:45:46.210830 IP 152.42.142.133.47516 > 138.197.157.175.22: Flags [P.], seq 1:13, ack 1, win 502, options [nop,nop,TS val 747052833 ecr 2012549849], length 12: SSH: SSH-2.0-Go
21:45:46.210874 IP 138.197.157.175.22 > 152.42.142.133.47516: Flags [.], ack 13, win 510, options [nop,nop,TS val 2012549989 ecr 747052833], length 0
21:45:46.223487 IP 72.39.77.253.49649 > 138.197.157.175.22: Flags [P.], seq 505:541, ack 5420, win 2047, length 36
21:45:46.223668 IP 138.197.157.175.22 > 72.39.77.253.49649: Flags [P.], seq 5420:5456, ack 541, win 4589, length 36
21:45:46.229851 IP 138.197.157.175.22 > 72.39.77.253.49649: Flags [P.], seq 5456:5612, ack 541, win 4589, length 156
21:45:46.230191 IP 138.197.157.175.22 > 72.39.77.253.49649: Flags [P.], seq 5612:7656, ack 541, win 4589, length 2044
21:45:46.239729 IP 72.39.77.253.49649 > 138.197.157.175.22: Flags [.], ack 5612, win 2046, length 0
21:45:46.241359 IP 72.39.77.253.49649 > 138.197.157.175.22: Flags [.], ack 7656, win 2047, length 0
21:45:46.253569 IP 72.39.77.253.49649 > 138.197.157.175.22: Flags [P.], seq 541:577, ack 7656, win 2047, length 36
21:45:46.253712 IP 138.197.157.175.22 > 72.39.77.253.49649: Flags [P.], seq 7656:7692, ack 577, win 4589, length 36
21:45:46.268025 IP 152.42.142.133.47516 > 138.197.157.175.22: Flags [.], ack 44, win 502, options [nop,nop,TS val 747052890 ecr 2012549953], length 0
21:45:46.268088 IP 138.197.157.175.22 > 152.42.142.133.47516: Flags [P.], seq 44:1164, ack 13, win 510, options [nop,nop,TS val 2012550046 ecr 747052890], length 1120
21:45:46.287457 IP 72.39.77.253.49649 > 138.197.157.175.22: Flags [P.], seq 577:613, ack 7692, win 2047, length 36
21:45:46.287671 IP 138.197.157.175.22 > 72.39.77.253.49649: Flags [P.], seq 7692:7728, ack 613, win 4589, length 36
21:45:46.294176 IP 152.42.142.133.47516 > 138.197.157.175.22: Flags [P.], seq 13:1053, ack 44, win 502, options [nop,nop,TS val 747052916 ecr 2012549953], length 1040
21:45:46.294215 IP 138.197.157.175.22 > 152.42.142.133.47516: Flags [.], ack 1053, win 533, options [nop,nop,TS val 2012550072 ecr 747052916], length 0
21:45:46.315581 IP 72.39.77.253.49649 > 138.197.157.175.22: Flags [P.], seq 613:649, ack 7728, win 2047, length 36
21:45:46.315744 IP 138.197.157.175.22 > 72.39.77.253.49649: Flags [P.], seq 7728:7764, ack 649, win 4589, length 36
21:45:46.334155 IP 138.197.157.175.22 > 72.39.77.253.49649: Flags [P.], seq 7764:7920, ack 649, win 4589, length 156
21:45:46.334717 IP 138.197.157.175.22 > 72.39.77.253.49649: Flags [P.], seq 7920:9620, ack 649, win 4589, length 1700
21:45:46.343491 IP 72.39.77.253.49649 > 138.197.157.175.22: Flags [.], ack 7920, win 2046, length 0
21:45:46.343492 IP 72.39.77.253.49649 > 138.197.157.175.22: Flags [P.], seq 649:685, ack 7920, win 2046, length 36
21:45:46.343492 IP 72.39.77.253.49649 > 138.197.157.175.22: Flags [.], ack 9620, win 2047, length 0
21:45:46.343674 IP 138.197.157.175.22 > 72.39.77.253.49649: Flags [P.], seq 9620:9656, ack 685, win 4589, length 36
21:45:46.368215 IP 152.42.142.133.47516 > 138.197.157.175.22: Flags [P.], seq 1053:1101, ack 1164, win 501, options [nop,nop,TS val 747052990 ecr 2012550046], length 48
21:45:46.368294 IP 138.197.157.175.22 > 152.42.142.133.47516: Flags [.], ack 1101, win 533, options [nop,nop,TS val 2012550146 ecr 747052990], length 0
21:45:46.379597 IP 72.39.77.253.49649 > 138.197.157.175.22: Flags [P.], seq 685:721, ack 9656, win 2047, length 36
21:45:46.380712 IP 138.197.157.175.22 > 72.39.77.253.49649: Flags [P.], seq 9656:9692, ack 721, win 4589, length 36
21:45:46.380977 IP 138.197.157.175.22 > 152.42.142.133.47516: Flags [P.], seq 1164:2360, ack 1101, win 533, options [nop,nop,TS val 2012550159 ecr 747052990], length 1196
21:45:46.397647 IP 138.197.157.175.22 > 167.99.47.139.36186: Flags [P.], seq 0:68, ack 1, win 502, options [nop,nop,TS val 1886761063 ecr 855912207], length 68
21:45:46.409489 IP 72.39.77.253.49649 > 138.197.157.175.22: Flags [P.], seq 721:757, ack 9692, win 2047, length 36
21:45:46.409705 IP 138.197.157.175.22 > 72.39.77.253.49649: Flags [P.], seq 9692:9728, ack 757, win 4589, length 36
21:45:46.437824 IP 138.197.157.175.22 > 72.39.77.253.49649: Flags [P.], seq 9728:9884, ack 757, win 4589, length 156
21:45:46.438076 IP 138.197.157.175.22 > 72.39.77.253.49649: Flags [P.], seq 9884:11592, ack 757, win 4589, length 1708
21:45:46.438115 IP 138.197.157.175.22 > 72.39.77.253.49649: Flags [P.], seq 11592:11628, ack 757, win 4589, length 36
21:45:46.440054 IP 72.39.77.253.49649 > 138.197.157.175.22: Flags [P.], seq 757:793, ack 9728, win 2047, length 36
21:45:46.440186 IP 138.197.157.175.22 > 72.39.77.253.49649: Flags [P.], seq 11628:11664, ack 793, win 4589, length 36
21:45:46.447401 IP 72.39.77.253.49649 > 138.197.157.175.22: Flags [.], ack 11628, win 2047, length 0
21:45:46.471368 IP 72.39.77.253.49649 > 138.197.157.175.22: Flags [P.], seq 793:829, ack 11664, win 2047, length 36
21:45:46.471562 IP 138.197.157.175.22 > 72.39.77.253.49649: Flags [P.], seq 11664:11700, ack 829, win 4589, length 36
21:45:46.480144 IP 152.42.142.133.47516 > 138.197.157.175.22: Flags [P.], seq 1101:1117, ack 2360, win 501, options [nop,nop,TS val 747053102 ecr 2012550159], length 16
21:45:46.480144 IP 152.42.142.133.47516 > 138.197.157.175.22: Flags [P.], seq 1117:1185, ack 2360, win 501, options [nop,nop,TS val 747053102 ecr 2012550159], length 68
21:45:46.480241 IP 138.197.157.175.22 > 152.42.142.133.47516: Flags [.], ack 1185, win 533, options [nop,nop,TS val 2012550258 ecr 747053102], length 0
21:45:46.480332 IP 138.197.157.175.22 > 152.42.142.133.47516: Flags [P.], seq 2360:2428, ack 1185, win 533, options [nop,nop,TS val 2012550258 ecr 747053102], length 68
21:45:46.501506 IP 72.39.77.253.49649 > 138.197.157.175.22: Flags [P.], seq 829:865, ack 11700, win 2047, length 36
21:45:46.501671 IP 138.197.157.175.22 > 72.39.77.253.49649: Flags [P.], seq 11700:11736, ack 865, win 4589, length 36
21:45:46.533611 IP 72.39.77.253.49649 > 138.197.157.175.22: Flags [P.], seq 865:901, ack 11736, win 2047, length 36
21:45:46.533807 IP 138.197.157.175.22 > 72.39.77.253.49649: Flags [P.], seq 11736:11772, ack 901, win 4589, length 36
21:45:46.542031 IP 138.197.157.175.22 > 72.39.77.253.49649: Flags [P.], seq 11772:11928, ack 901, win 4589, length 156
21:45:46.542348 IP 138.197.157.175.22 > 72.39.77.253.49649: Flags [P.], seq 11928:13268, ack 901, win 4589, length 1340
21:45:46.542487 IP 138.197.157.175.22 > 72.39.77.253.49649: Flags [P.], seq 13268:13952, ack 901, win 4589, length 684
21:45:46.551504 IP 72.39.77.253.49649 > 138.197.157.175.22: Flags [.], ack 11928, win 2046, length 0
21:45:46.553478 IP 72.39.77.253.49649 > 138.197.157.175.22: Flags [.], ack 13952, win 2047, length 0
21:45:46.557554 IP 72.39.77.253.49649 > 138.197.157.175.22: Flags [P.], seq 901:937, ack 13952, win 2047, length 36
21:45:46.576310 IP 152.42.142.133.47516 > 138.197.157.175.22: Flags [P.], seq 1185:1269, ack 2428, win 501, options [nop,nop,TS val 747053198 ecr 2012550258], length 84
21:45:46.579692 IP 72.39.77.253.49649 > 138.197.157.175.22: Flags [P.], seq 937:973, ack 13952, win 2047, length 36
21:45:46.579956 IP 138.197.157.175.22 > 152.42.142.133.47516: Flags [P.], seq 2428:2496, ack 1269, win 533, options [nop,nop,TS val 2012550358 ecr 747053198], length 68
21:45:46.580011 IP 138.197.157.175.22 > 72.39.77.253.49649: Flags [.], ack 973, win 4589, length 0
21:45:46.580044 IP 138.197.157.175.22 > 72.39.77.253.49649: Flags [P.], seq 13952:13988, ack 973, win 4589, length 36
21:45:46.609608 IP 72.39.77.253.49649 > 138.197.157.175.22: Flags [P.], seq 973:1009, ack 13988, win 2047, length 36
21:45:46.609794 IP 138.197.157.175.22 > 72.39.77.253.49649: Flags [P.], seq 13988:14024, ack 1009, win 4589, length 36
21:45:46.612062 IP 167.99.47.139.36186 > 138.197.157.175.22: Flags [F.], seq 1, ack 68, win 501, options [nop,nop,TS val 855913945 ecr 1886760759], length 0
21:45:46.614072 IP 138.197.157.175.22 > 167.99.47.139.36186: Flags [F.], seq 68, ack 2, win 502, options [nop,nop,TS val 1886761279 ecr 855913945], length 0
21:45:46.641579 IP 72.39.77.253.49649 > 138.197.157.175.22: Flags [P.], seq 1009:1045, ack 14024, win 2047, length 36
21:45:46.641747 IP 138.197.157.175.22 > 72.39.77.253.49649: Flags [P.], seq 14024:14060, ack 1045, win 4589, length 36
21:45:46.645830 IP 138.197.157.175.22 > 72.39.77.253.49649: Flags [P.], seq 14060:14216, ack 1045, win 4589, length 156
21:45:46.646108 IP 138.197.157.175.22 > 72.39.77.253.49649: Flags [P.], seq 14216:16284, ack 1045, win 4589, length 2068
21:45:46.655585 IP 72.39.77.253.49649 > 138.197.157.175.22: Flags [.], ack 16284, win 2047, length 0
21:45:46.671530 IP 72.39.77.253.49649 > 138.197.157.175.22: Flags [P.], seq 1045:1081, ack 16284, win 2047, length 36
21:45:46.671689 IP 138.197.157.175.22 > 72.39.77.253.49649: Flags [P.], seq 16284:16320, ack 1081, win 4589, length 36
21:45:46.674012 IP 152.42.142.133.47516 > 138.197.157.175.22: Flags [P.], seq 1269:1369, ack 2496, win 501, options [nop,nop,TS val 747053296 ecr 2012550358], length 100
21:45:46.701646 IP 72.39.77.253.49649 > 138.197.157.175.22: Flags [P.], seq 1081:1117, ack 16320, win 2047, length 36
21:45:46.701789 IP 138.197.157.175.22 > 72.39.77.253.49649: Flags [P.], seq 16320:16356, ack 1117, win 4589, length 36
21:45:46.714632 IP 138.197.157.175.22 > 152.42.142.133.47516: Flags [.], ack 1369, win 533, options [nop,nop,TS val 2012550493 ecr 747053296], length 0
21:45:46.731451 IP 72.39.77.253.49649 > 138.197.157.175.22: Flags [P.], seq 1117:1153, ack 16356, win 2047, length 36
21:45:46.731672 IP 138.197.157.175.22 > 72.39.77.253.49649: Flags [P.], seq 16356:16392, ack 1153, win 4589, length 36
21:45:46.749968 IP 138.197.157.175.22 > 72.39.77.253.49649: Flags [P.], seq 16392:16548, ack 1153, win 4589, length 156
21:45:46.750212 IP 138.197.157.175.22 > 72.39.77.253.49649: Flags [P.], seq 16548:17848, ack 1153, win 4589, length 1300
21:45:46.759590 IP 72.39.77.253.49649 > 138.197.157.175.22: Flags [.], ack 16548, win 2046, length 0
21:45:46.761405 IP 72.39.77.253.49649 > 138.197.157.175.22: Flags [P.], seq 1153:1189, ack 16548, win 2046, length 36
21:45:46.761405 IP 72.39.77.253.49649 > 138.197.157.175.22: Flags [.], ack 17848, win 2047, length 0
21:45:46.761592 IP 138.197.157.175.22 > 72.39.77.253.49649: Flags [P.], seq 17848:17884, ack 1189, win 4589, length 36
21:45:46.771711 IP 72.39.77.253.49649 > 138.197.157.175.22: Flags [.], ack 17884, win 2047, length 0
21:45:46.791533 IP 72.39.77.253.49649 > 138.197.157.175.22: Flags [P.], seq 1189:1225, ack 17884, win 2047, length 36
21:45:46.791690 IP 138.197.157.175.22 > 72.39.77.253.49649: Flags [P.], seq 17884:17920, ack 1225, win 4589, length 36
21:45:46.825397 IP 72.39.77.253.49649 > 138.197.157.175.22: Flags [P.], seq 1225:1261, ack 17920, win 2047, length 36
21:45:46.825537 IP 138.197.157.175.22 > 72.39.77.253.49649: Flags [P.], seq 17920:17956, ack 1261, win 4589, length 36
21:45:46.853805 IP 138.197.157.175.22 > 72.39.77.253.49649: Flags [P.], seq 17956:18112, ack 1261, win 4589, length 156
21:45:46.853969 IP 138.197.157.175.22 > 72.39.77.253.49649: Flags [P.], seq 18112:19292, ack 1261, win 4589, length 1180
21:45:46.855563 IP 72.39.77.253.49649 > 138.197.157.175.22: Flags [P.], seq 1261:1297, ack 17956, win 2047, length 36
21:45:46.855655 IP 138.197.157.175.22 > 72.39.77.253.49649: Flags [P.], seq 19292:19328, ack 1297, win 4589, length 36
21:45:46.863408 IP 72.39.77.253.49649 > 138.197.157.175.22: Flags [.], ack 19292, win 2042, length 0
21:45:46.885867 IP 72.39.77.253.49649 > 138.197.157.175.22: Flags [P.], seq 1297:1333, ack 19328, win 2047, length 36
21:45:46.886064 IP 138.197.157.175.22 > 72.39.77.253.49649: Flags [P.], seq 19328:19364, ack 1333, win 4589, length 36
21:45:46.917498 IP 72.39.77.253.49649 > 138.197.157.175.22: Flags [P.], seq 1333:1369, ack 19364, win 2047, length 36
21:45:46.917705 IP 138.197.157.175.22 > 72.39.77.253.49649: Flags [P.], seq 19364:19400, ack 1369, win 4589, length 36
21:45:46.947353 IP 72.39.77.253.49649 > 138.197.157.175.22: Flags [P.], seq 1369:1405, ack 19400, win 2047, length 36
21:45:46.947519 IP 138.197.157.175.22 > 72.39.77.253.49649: Flags [P.], seq 19400:19436, ack 1405, win 4589, length 36
21:45:46.958013 IP 138.197.157.175.22 > 72.39.77.253.49649: Flags [P.], seq 19436:19592, ack 1405, win 4589, length 156
21:45:46.958198 IP 138.197.157.175.22 > 72.39.77.253.49649: Flags [P.], seq 19592:20812, ack 1405, win 4589, length 1220
21:45:46.968125 IP 72.39.77.253.49649 > 138.197.157.175.22: Flags [.], ack 19592, win 2046, length 0
21:45:46.968126 IP 72.39.77.253.49649 > 138.197.157.175.22: Flags [P.], seq 1405:1441, ack 19592, win 2046, length 36
21:45:46.968126 IP 72.39.77.253.49649 > 138.197.157.175.22: Flags [.], ack 20812, win 2047, length 0
21:45:46.968300 IP 138.197.157.175.22 > 72.39.77.253.49649: Flags [P.], seq 20812:20848, ack 1441, win 4589, length 36
21:45:46.979374 IP 72.39.77.253.49649 > 138.197.157.175.22: Flags [.], ack 20848, win 2047, length 0
21:45:46.993411 IP 72.39.77.253.49649 > 138.197.157.175.22: Flags [P.], seq 1441:1477, ack 20848, win 2047, length 36
21:45:46.993625 IP 138.197.157.175.22 > 72.39.77.253.49649: Flags [P.], seq 20848:20884, ack 1477, win 4589, length 36
21:45:47.023670 IP 72.39.77.253.49649 > 138.197.157.175.22: Flags [P.], seq 1477:1513, ack 20884, win 2047, length 36
21:45:47.023863 IP 138.197.157.175.22 > 72.39.77.253.49649: Flags [P.], seq 20884:20920, ack 1513, win 4589, length 36
21:45:47.055368 IP 72.39.77.253.49649 > 138.197.157.175.22: Flags [P.], seq 1513:1549, ack 20920, win 2047, length 36
21:45:47.055534 IP 138.197.157.175.22 > 72.39.77.253.49649: Flags [P.], seq 20920:20956, ack 1549, win 4589, length 36
21:45:47.061847 IP 138.197.157.175.22 > 72.39.77.253.49649: Flags [P.], seq 20956:21112, ack 1549, win 4589, length 156
21:45:47.062078 IP 138.197.157.175.22 > 72.39.77.253.49649: Flags [P.], seq 21112:22532, ack 1549, win 4589, length 1420
21:45:47.071500 IP 72.39.77.253.49649 > 138.197.157.175.22: Flags [.], ack 21112, win 2046, length 0
21:45:47.087353 IP 72.39.77.253.49649 > 138.197.157.175.22: Flags [P.], seq 1549:1585, ack 22532, win 2047, length 36
21:45:47.087500 IP 138.197.157.175.22 > 72.39.77.253.49649: Flags [P.], seq 22532:22568, ack 1585, win 4589, length 36
21:45:47.117630 IP 138.197.157.175.22 > 167.99.47.139.36186: Flags [F.], seq 68, ack 2, win 502, options [nop,nop,TS val 1886761783 ecr 855913945], length 0
21:45:47.117688 IP 72.39.77.253.49649 > 138.197.157.175.22: Flags [P.], seq 1585:1621, ack 22568, win 2047, length 36
21:45:47.117885 IP 138.197.157.175.22 > 72.39.77.253.49649: Flags [P.], seq 22568:22604, ack 1621, win 4589, length 36
21:45:47.149617 IP 72.39.77.253.49649 > 138.197.157.175.22: Flags [P.], seq 1621:1657, ack 22604, win 2047, length 36
21:45:47.149808 IP 138.197.157.175.22 > 72.39.77.253.49649: Flags [P.], seq 22604:22640, ack 1657, win 4589, length 36
21:45:47.166046 IP 138.197.157.175.22 > 72.39.77.253.49649: Flags [P.], seq 22640:23900, ack 1657, win 4589, length 1260
21:45:47.175426 IP 72.39.77.253.49649 > 138.197.157.175.22: Flags [.], ack 23900, win 2042, length 0
21:45:47.177639 IP 72.39.77.253.49649 > 138.197.157.175.22: Flags [P.], seq 1657:1693, ack 23900, win 2042, length 36
21:45:47.177793 IP 138.197.157.175.22 > 72.39.77.253.49649: Flags [P.], seq 23900:23936, ack 1693, win 4589, length 36
21:45:47.209351 IP 72.39.77.253.49649 > 138.197.157.175.22: Flags [P.], seq 1693:1729, ack 23936, win 2042, length 36
21:45:47.209534 IP 138.197.157.175.22 > 72.39.77.253.49649: Flags [P.], seq 23936:23972, ack 1729, win 4589, length 36
21:45:47.232289 IP 167.99.47.139.36186 > 138.197.157.175.22: Flags [.], ack 69, win 501, options [nop,nop,TS val 855914617 ecr 1886761783], length 0
21:45:47.241359 IP 72.39.77.253.49649 > 138.197.157.175.22: Flags [P.], seq 1729:1765, ack 23972, win 2042, length 36
21:45:47.241522 IP 138.197.157.175.22 > 72.39.77.253.49649: Flags [P.], seq 23972:24008, ack 1765, win 4589, length 36
21:45:47.269815 IP 138.197.157.175.22 > 72.39.77.253.49649: Flags [P.], seq 24008:24164, ack 1765, win 4589, length 156
21:45:47.270032 IP 138.197.157.175.22 > 72.39.77.253.49649: Flags [P.], seq 24164:25168, ack 1765, win 4589, length 1004
21:45:47.272023 IP 72.39.77.253.49649 > 138.197.157.175.22: Flags [P.], seq 1765:1801, ack 24008, win 2047, length 36
21:45:47.272159 IP 138.197.157.175.22 > 72.39.77.253.49649: Flags [P.], seq 25168:25204, ack 1801, win 4589, length 36
21:45:47.279312 IP 72.39.77.253.49649 > 138.197.157.175.22: Flags [.], ack 25168, win 2043, length 0
21:45:47.303285 IP 72.39.77.253.49649 > 138.197.157.175.22: Flags [P.], seq 1801:1837, ack 25204, win 2043, length 36
21:45:47.303483 IP 138.197.157.175.22 > 72.39.77.253.49649: Flags [P.], seq 25204:25240, ack 1837, win 4589, length 36
21:45:47.333478 IP 72.39.77.253.49649 > 138.197.157.175.22: Flags [P.], seq 1837:1873, ack 25240, win 2043, length 36
21:45:47.333717 IP 138.197.157.175.22 > 72.39.77.253.49649: Flags [P.], seq 25240:25276, ack 1873, win 4589, length 36
21:45:47.365517 IP 72.39.77.253.49649 > 138.197.157.175.22: Flags [P.], seq 1873:1909, ack 25276, win 2043, length 36
21:45:47.365710 IP 138.197.157.175.22 > 72.39.77.253.49649: Flags [P.], seq 25276:25312, ack 1909, win 4589, length 36
21:45:47.374061 IP 138.197.157.175.22 > 72.39.77.253.49649: Flags [P.], seq 25312:25468, ack 1909, win 4589, length 156
21:45:47.374370 IP 138.197.157.175.22 > 72.39.77.253.49649: Flags [P.], seq 25468:26688, ack 1909, win 4589, length 1220
21:45:47.383693 IP 72.39.77.253.49649 > 138.197.157.175.22: Flags [.], ack 25468, win 2047, length 0
21:45:47.385536 IP 72.39.77.253.49649 > 138.197.157.175.22: Flags [P.], seq 1909:1945, ack 26688, win 2043, length 36
21:45:47.385693 IP 138.197.157.175.22 > 72.39.77.253.49649: Flags [P.], seq 26688:26724, ack 1945, win 4589, length 36
21:45:47.411544 IP 72.39.77.253.49649 > 138.197.157.175.22: Flags [P.], seq 1945:1981, ack 26724, win 2043, length 36
21:45:47.411761 IP 138.197.157.175.22 > 72.39.77.253.49649: Flags [P.], seq 26724:26760, ack 1981, win 4589, length 36
21:45:47.441553 IP 72.39.77.253.49649 > 138.197.157.175.22: Flags [P.], seq 1981:2017, ack 26760, win 2042, length 36
21:45:47.441725 IP 138.197.157.175.22 > 72.39.77.253.49649: Flags [P.], seq 26760:26796, ack 2017, win 4589, length 36
21:45:47.469397 IP 72.39.77.253.49649 > 138.197.157.175.22: Flags [P.], seq 2017:2053, ack 26796, win 2042, length 36
21:45:47.469590 IP 138.197.157.175.22 > 72.39.77.253.49649: Flags [P.], seq 26796:26832, ack 2053, win 4589, length 36
21:45:47.477836 IP 138.197.157.175.22 > 72.39.77.253.49649: Flags [P.], seq 26832:26988, ack 2053, win 4589, length 156
21:45:47.478046 IP 138.197.157.175.22 > 72.39.77.253.49649: Flags [P.], seq 26988:28208, ack 2053, win 4589, length 1220
21:45:47.489533 IP 72.39.77.253.49649 > 138.197.157.175.22: Flags [.], ack 26988, win 2047, length 0
21:45:47.504581 IP 72.39.77.253.49649 > 138.197.157.175.22: Flags [P.], seq 2053:2089, ack 28208, win 2043, length 36
21:45:47.504752 IP 138.197.157.175.22 > 72.39.77.253.49649: Flags [P.], seq 28208:28244, ack 2089, win 4589, length 36
21:45:47.533518 IP 72.39.77.253.49649 > 138.197.157.175.22: Flags [P.], seq 2089:2125, ack 28244, win 2043, length 36
21:45:47.533683 IP 138.197.157.175.22 > 72.39.77.253.49649: Flags [P.], seq 28244:28280, ack 2125, win 4589, length 36
21:45:47.563432 IP 72.39.77.253.49649 > 138.197.157.175.22: Flags [P.], seq 2125:2161, ack 28280, win 2042, length 36
21:45:47.563622 IP 138.197.157.175.22 > 72.39.77.253.49649: Flags [P.], seq 28280:28316, ack 2161, win 4589, length 36
^Z
[8]+  Stopped                 tcpdump -n -i eth0
